Authors,Author full names,Author(s) ID,Title,Year,Source title,Volume,Issue,Art. No.,Page start,Page end,Cited by,DOI,Link,Abstract,Author Keywords,Document Type,Publication Stage,Open Access,Source,EID
"Bonomi, L.; Jiang, X.","Bonomi, Luca (55522738500); Jiang, Xiaoqian (59051718600)",55522738500; 59051718600,Pattern similarity in time interval sequences,2018,"Proceedings - 2018 IEEE International Conference on Healthcare Informatics, ICHI 2018",,,8419420,434,435,2,10.1109/ICHI.2018.00087,https://www.scopus.com/inward/record.uri?eid=2-s2.0-85051143389&doi=10.1109%2FICHI.2018.00087&partnerID=40&md5=62cd65a4230efdf6b127a43a2cf98e74,"The extraction of temporal patterns from biomedical data is central in facilitating clinical decision support and enabling proactive interventions. Despite several approaches have been proposed for efficiently mining temporal patterns, most of the current solutions offer limited flexibility in addressing the noise in the data. To this end, we propose a similarity measure for temporal patterns in time interval sequences, we develop two mining approaches and conduct a preliminary evaluation on a real world dataset. © 2018 IEEE.",Data Mining; EHR Data; Similarity Measure; Temporal Pattern,Conference paper,Final,,Scopus,2-s2.0-85051143389
"Bonomi, L.; Jiang, X.","Bonomi, Luca (55522738500); Jiang, Xiaoqian (59051718600)",55522738500; 59051718600,Patient ranking with temporally annotated data,2018,Journal of Biomedical Informatics,78,,,43,53,9,10.1016/j.jbi.2017.12.007,https://www.scopus.com/inward/record.uri?eid=2-s2.0-85040671260&doi=10.1016%2Fj.jbi.2017.12.007&partnerID=40&md5=b94327c1e8bb23088def50267cddc575,"Modern medical information systems enable the collection of massive temporal health data. Albeit these data have great potentials for advancing medical research, the data exploration and extraction of useful knowledge present significant challenges. In this work, we develop a new pattern matching technique which aims to facilitate the discovery of clinically useful knowledge from large temporal datasets. Our approach receives in input a set of temporal patterns modeling specific events of interest (e.g., doctor's knowledge, symptoms of diseases) and it returns data instances matching these patterns (e.g., patients exhibiting the specified symptoms). The resulting instances are ranked according to a significance score based on the p-value. Our experimental evaluations on a real-world dataset demonstrate the efficiency and effectiveness of our approach. © 2017 Elsevier Inc.",Data mining; EHR data; Sequential patterns; Temporal data,Article,Final,All Open Access; Green Accepted Open Access; Green Open Access,Scopus,2-s2.0-85040671260
"Bonomi, L.; Jiang, X.","Bonomi, Luca (55522738500); Jiang, Xiaoqian (59051718600)",55522738500; 59051718600,A mortality study for ICU patients using bursty medical events,2017,Proceedings - International Conference on Data Engineering,,,7930121,1533,1540,5,10.1109/ICDE.2017.224,https://www.scopus.com/inward/record.uri?eid=2-s2.0-85021205006&doi=10.1109%2FICDE.2017.224&partnerID=40&md5=1a62ba65e7c7b3b0703c20247d70deec,"The study of patients in Intensive Care Units (ICUs) is a crucial task in critical care research which has significant implications both in identifying clinical risk factors and defining institutional guidances. The mortality study of ICU patients is of particular interest because it provides useful indications to healthcare institutions for improving patients experience, internal policies, and procedures (e.g. allocation of resources). To this end, many research works have been focused on the length of stay (LOS) for ICU patients as a feature for studying the mortality. In this work, we propose a novel mortality study based on the notion of burstiness, where the temporal information of patients longitudinal data is taken into consideration. The burstiness of temporal data is a popular measure in network analysis and time-series anomaly detection, where high values of burstiness indicate presence of rapidly occurring events in short time periods (i.e. burst). Our intuition is that these bursts may relate to possible complications in the patient's medical condition and hence provide indications on the mortality. Compared to the LOS, the burstiness parameter captures the temporality of the medical events providing information about the overall dynamic of the patients condition. To the best of our knowledge, we are the first to apply the burstiness measure in the clinical research domain. Our preliminary results on a real dataset show that patients with high values of burstiness tend to have higher mortality rate compared to patients with more regular medical events. Overall, our study shows promising results and provides useful insights for developing predictive models on temporal data and advancing modern critical care medicine. © 2017 IEEE.",,Conference paper,Final,All Open Access; Green Accepted Open Access; Green Open Access,Scopus,2-s2.0-85021205006
"Fan, L.; Bonomi, L.; Shahabi, C.; Xiong, L.","Fan, Liyue (57094441400); Bonomi, Luca (55522738500); Shahabi, Cyrus (7004263107); Xiong, Li (47461765600)",57094441400; 55522738500; 7004263107; 47461765600,Multi-user itinerary planning for optimal group preference,2017,Lecture Notes in Computer Science (including subseries Lecture Notes in Artificial Intelligence and Lecture Notes in Bioinformatics),10411 LNCS,,,3,23,9,10.1007/978-3-319-64367-0_1,https://www.scopus.com/inward/record.uri?eid=2-s2.0-85028456869&doi=10.1007%2F978-3-319-64367-0_1&partnerID=40&md5=4cfacd7b22d9b1a0cb6142d94c458274,"The increasing popularity of location-based applications creates new opportunities for users to travel together. In this paper, we study a novel spatio-social optimization problem, i.e., Optimal Group Route, for multi-user itinerary planning. With our problem formulation, users can individually specify sources and destinations, preferences on the Point-of-interest (POI) categories, as well as the distance constraints. The goal is to find a itinerary that can be traversed by all the users while maximizing the group’s preference of POI categories in the itinerary. Our work advances existing group trip planning studies by maximizing the group’s social experience. To this end, individual preferences of POI categories are aggregated by considering the agreement and disagreement among group members. Furthermore, planning a multi-user itinerary on large real-world networks is computationally challenging. We propose one approximate solution with bounded approximation ratio and one exact solution which computes the optimal itinerary by exploring a limited number of paths in the road network. In addition, an effective compression algorithm is developed to reduce the size of the network, providing a significant acceleration in our exact solution. We conduct extensive empirical evaluations on the road network and POI datasets of Los Angeles and our results confirm the effectiveness and efficiency of our solutions. © Springer International Publishing AG 2017.",,Conference paper,Final,,Scopus,2-s2.0-85028456869
"Wang, S.; Jiang, X.; Singh, S.; Marmor, R.; Bonomi, L.; Fox, D.; Dow, M.; Ohno-Machado, L.","Wang, Shuang (55796493600); Jiang, Xiaoqian (59051718600); Singh, Siddharth (37066442700); Marmor, Rebecca A. (56946770700); Bonomi, Luca (55522738500); Fox, Dov (23481820700); Dow, Michelle T. (57192072311); Ohno-Machado, Lucila (7005192335)",55796493600; 59051718600; 37066442700; 56946770700; 55522738500; 23481820700; 57192072311; 7005192335,"Genome privacy: challenges, technical approaches to mitigate risk, and ethical considerations in the United States",2017,Annals of the New York Academy of Sciences,1387,1,,73,83,66,10.1111/nyas.13259,https://www.scopus.com/inward/record.uri?eid=2-s2.0-84996484171&doi=10.1111%2Fnyas.13259&partnerID=40&md5=2b7896f0269dd88558d9533bb8b8c033,"Accessing and integrating human genomic data with phenotypes are important for biomedical research. Making genomic data accessible for research purposes, however, must be handled carefully to avoid leakage of sensitive individual information to unauthorized parties and improper use of data. In this article, we focus on data sharing within the scope of data accessibility for research. Current common practices to gain biomedical data access are strictly rule based, without a clear and quantitative measurement of the risk of privacy breaches. In addition, several types of studies require privacy-preserving linkage of genotype and phenotype information across different locations (e.g., genotypes stored in a sequencing facility and phenotypes stored in an electronic health record) to accelerate discoveries. The computer science community has developed a spectrum of techniques for data privacy and confidentiality protection, many of which have yet to be tested on real-world problems. In this article, we discuss clinical, technical, and ethical aspects of genome data privacy and confidentiality in the United States, as well as potential solutions for privacy-preserving genotype–phenotype linkage in biomedical research. © 2016 New York Academy of Sciences.",ethics; genome privacy and confidentiality; privacy law; record linkage,Article,Final,All Open Access; Green Accepted Open Access; Green Open Access,Scopus,2-s2.0-84996484171
"Bonomi, L.; Xiong, L.","Bonomi, Luca (55522738500); Xiong, Li (47461765600)",55522738500; 47461765600,On differentially private longest increasing subsequence computation in data stream,2016,Transactions on Data Privacy,9,1,,73,100,10,,https://www.scopus.com/inward/record.uri?eid=2-s2.0-84964220592&partnerID=40&md5=5cac015d8fa3c227b5f61f6c6a29e677,"Many important applications require a continuous computation of statistics over data streams. Activities monitoring, surveillance and fraud detections are some settings where it is crucial for the monitoring applications to protect user’s sensitive information in addition to efficiently compute the required statistics. In the last two decades, a broad range of techniques for time-series and stream data monitoring has been developed to provide provable privacy guarantees employing the formal notion of differential privacy. Although these solutions are well established, they are mostly limited to count based statistics (e.g. number of distinct elements, heavy hitters) and do not apply in settings where more complex statistics are needed. In this paper, we consider a more general problem of estimating the sortedness of a data stream by privately computing the length of the longest increasing subsequence (LIS). This important statistic can be used to detect surprising trends in time-series data (e.g. finance) and perform approximate string matching in computational biology domains. Our proposed approaches employ the differential privacy notion which provides strong and provable privacy guarantees. Our solutions estimate the length of the LIS using block decomposition and local approximation techniques. We provide a rigorous analysis to bound the approximation error of our algorithms in terms of privacy level and length of the stream. Furthermore, we extend our solutions to computing the length of the LIS over sliding windows and we show the beneficial effects of this formulation on the final utility. An extensive experimental evaluation of our proposed solutions on real-world data streams demonstrates the effectiveness of our approaches for computing accurate statistics and detecting surprising trends. © 2016, IIIA-CSIC. All rights reserved.",,Article,Final,,Scopus,2-s2.0-84964220592
"Bonomi, L.; Fan, L.; Jin, H.","Bonomi, Luca (55522738500); Fan, Liyue (57094441400); Jin, Hongxia (57202307406)",55522738500; 57094441400; 57202307406,An information-theoretic approach to individual sequential data sanitization,2016,WSDM 2016 - Proceedings of the 9th ACM International Conference on Web Search and Data Mining,,,,337,346,15,10.1145/2835776.2835828,https://www.scopus.com/inward/record.uri?eid=2-s2.0-84964330093&doi=10.1145%2F2835776.2835828&partnerID=40&md5=ddea16cc31f9d30c23a6f57eb9fdeaba,"Fine-grained, personal data has been largely, continuously generated nowadays, such as location check-ins, web histories, physical activities, etc. Those data sequences are typically shared with untrusted parties for data analysis and promotional services. However, the individually-generated sequential data contains behavior patterns and may disclose sensitive information if not properly sanitized. Furthermore, the utility of the released sequence can be adversely affected by sanitization techniques. In this paper, we study the problem of individual sequence data sanitization with minimum utility loss, given user-specified sensitive patterns. We propose a privacy notion based on information theory and sanitize sequence data via generalization. We show the optimization problem is hard and develop two efficient heuristic solutions. Extensive experimental evaluations are conducted on real-world datasets and the results demonstrate the eficiency and effectiveness of our solutions. © 2016 ACM.",Data sanitization; Mutual information; Sequential patterns,Conference paper,Final,,Scopus,2-s2.0-84964330093
"Bonomi, L.; Fan, L.; Xiong, L.","Bonomi, Luca (55522738500); Fan, Liyue (57094441400); Xiong, Li (47461765600)",55522738500; 57094441400; 47461765600,A review of privacy preserving mechanisms for record linkage,2015,Medical Data Privacy Handbook,,,,233,265,3,10.1007/978-3-319-23633-9_10,https://www.scopus.com/inward/record.uri?eid=2-s2.0-84957013864&doi=10.1007%2F978-3-319-23633-9_10&partnerID=40&md5=6a6d5b8e6888404dbd27f79c52e96c13,"Record linkage represents the process of identifying records that refer to the same real-world entity across multiple sources. In the recent past, the large explosion of data from organizations and individuals has created critical challenges in record linkage process, leading the scientific community to develop a rich series of techniques. Among these recent developments, the design of record linkage solutions for medical data is a cornerstone for health-care systems, as personal identifying information, such as name and date of birth, is often used for linkage. In this setting, record linkage solutions are expected to preserve individual patients’ privacy in addition to be effective and efficient. In this chapter, we provide a broad review of the recent works in privacy preserving record linkage (PPRL). From a privacy-centric perspective, we summarize a comprehensive framework of the PPRL process and describe the privacy assurance techniques adopted for each step in the framework.With the applications in biomedical domain in mind, we identify several challenges for PPRL and discuss future research directions. © Springer International Publishing Switzerland 2015.",,Book chapter,Final,,Scopus,2-s2.0-84957013864
"Bonomi, L.; Xiong, L.","Bonomi, Luca (55522738500); Xiong, Li (47461765600)",55522738500; 47461765600,Private computation of the longest increasing subsequence in data streams,2015,CEUR Workshop Proceedings,1330,,,270,277,0,,https://www.scopus.com/inward/record.uri?eid=2-s2.0-84924993162&partnerID=40&md5=a26b7825bd5b5a501e70482185e0da9b,"In this paper, we study the problem of privately computing ordered statistics with the goal of monitoring sequential data streams. Despite the broad series of techniques for time-series monitoring, only few works provide provable privacy guarantees employing the formal notion of differential privacy. While these solutions are well established, their focus is mostly limited to count based statistics (e.g. number of distinct elements, heavy hitters). In this paper, we consider a more general problem of privately computing the length of the longest increasing subsequence (LIS) in the data stream model. This important statistic can be used to detect trends in time-series data (e.g. finance) and perform approximate string matching in computational biology domains. Our proposed approaches employ the differential privacy notion which provides strong and provable privacy guarantees. Our solutions estimate the length of the LIS using block decomposition and local approximation techniques. We provide a rigorous analysis to bound the approximation error of our algorithms in terms of privacy level and length of the stream. © 2015, Copyright is with the authors.",,Conference paper,Final,,Scopus,2-s2.0-84924993162
"Fan, L.; Bonomi, L.; Xiong, L.; Sunderam, V.","Fan, Liyue (57094441400); Bonomi, Luca (55522738500); Xiong, Li (47461765600); Sunderam, Vaidy S. (7005423913)",57094441400; 55522738500; 47461765600; 7005423913,Monitoring web browsing behavior with differential privacy,2014,WWW 2014 - Proceedings of the 23rd International Conference on World Wide Web,,,,177,187,51,10.1145/2566486.2568038,https://www.scopus.com/inward/record.uri?eid=2-s2.0-84909620009&doi=10.1145%2F2566486.2568038&partnerID=40&md5=ade63dc456a1bd7f57e7f6651393e382,"Monitoring web browsing behavior has benefited many data mining applications, such as top-K discovery and anomaly detection. However, releasing private user data to the greater public would concern web users about their privacy, especially after the incident of AOL search log release where anonymization was not correctly done. In this paper, we adopt differential privacy, a strong, provable privacy definition, and show that differentially private aggregates of web browsing activities can be released in real-time while preserving the utility of shared data. Our proposed algorithms utilize the rich correlation of the time series of aggregated data and adopt a state-space approach to estimate the underlying, true aggregates from the perturbed values by the differential privacy mechanism. We evaluate our algorithms with real-world web browsing data. Utility evaluations with three metrics demonstrate that the quality of the private, released data by our solutions closely resembles that of the original, unperturbed aggregates Copyright is held by the International World Wide Web Conference Committee (IW3C2).",Differential Privacy; Web Mining; Web Monitoring,Conference paper,Final,,Scopus,2-s2.0-84909620009
"Bonomi, L.; Xiong, L.","Bonomi, Luca (55522738500); Xiong, Li (47461765600)",55522738500; 47461765600,A two-phase algorithm for mining sequential patterns with differential privacy,2013,"International Conference on Information and Knowledge Management, Proceedings",,,,269,278,72,10.1145/2505515.2505553,https://www.scopus.com/inward/record.uri?eid=2-s2.0-84889607657&doi=10.1145%2F2505515.2505553&partnerID=40&md5=4423048aa1cad5bf3edbafdb8064f23e,"Frequent sequential pattern mining is a central task in many fields such as biology and finance. However, release of these patterns is raising increasing concerns on individual privacy. In this paper, we study the sequential pattern mining problem under the differential privacy framework which provides formal and provable guarantees of privacy. Due to the nature of the differential privacy mechanism which perturbs the frequency results with noise, and the high dimensionality of the pattern space, this mining problem is particularly challenging. In this work, we propose a novel two-phase algorithm for mining both prefixes and substring patterns. In the first phase, our approach takes advantage of the statistical properties of the data to construct a model-based prefix tree which is used to mine prefixes and a candidate set of substring patterns. The frequency of the substring patterns is further refined in the successive phase where we employ a novel transformation of the original data to reduce the perturbation noise. Extensive experiment results using real datasets showed that our approach is effective for mining both substring and prefix patterns in comparison to the state-of-the-art solutions. Copyright 2013 ACM.",Differential privacy; Frequent patterns; Sequential data,Conference paper,Final,,Scopus,2-s2.0-84889607657
"Bonomi, L.; Xiong, L.; Lu, J.J.","Bonomi, Luca (55522738500); Xiong, Li (47461765600); Lu, James J. (56141782700)",55522738500; 47461765600; 56141782700,LinkIT: Privacy preserving record linkage and integration via transformations,2013,Proceedings of the ACM SIGMOD International Conference on Management of Data,,,,1029,1032,10,10.1145/2463676.2465259,https://www.scopus.com/inward/record.uri?eid=2-s2.0-84880563131&doi=10.1145%2F2463676.2465259&partnerID=40&md5=9fbc05533a664e0a0e1f91b0e0c0136d,"We propose to demonstrate an open-source tool, LinkIT, for privacy preserving record Linkage and Integration via data Transformations. LinkIT implements novel algorithms that support data transformations for linking sensitive attributes, and is designed to work with our previously developed tool, FRIL (Fine-grained Record Integration and Linkage), to provide a complete record linkage solution. LinkIT can be also used as a stand-alone secure transformation tool to link string records. The system uses a novel embedding technique based on frequent variable length grams mined from original records with differential privacy, and utilizes a personalized threshold for performing linkage in the embedded space. Compared to the state-of-the-art secure transformation method [16], LinkIT guarantees stronger privacy with better scalability while achieving comparable utility results. Copyright © 2013 ACM.",Privacy; Record Linkage; Security,Conference paper,Final,,Scopus,2-s2.0-84880563131
"Bonomi, L.","Bonomi, Luca (55522738500)",55522738500,Mining frequent patterns with differential privacy,2013,Proceedings of the VLDB Endowment,6,12,,1422,1427,22,10.14778/2536274.2536329,https://www.scopus.com/inward/record.uri?eid=2-s2.0-84891085500&doi=10.14778%2F2536274.2536329&partnerID=40&md5=c6e580b97f91fe6fa15cf3f7cc3b1396,"The mining of frequent patterns is a fundamental component in many data mining tasks. A considerable amount of research on this problem has led to a wide series of efficient and scalable algorithms for mining frequent patterns. However, releasing these patterns is posing concerns on the privacy of the users participating in the data. Indeed the information from the patterns can be linked with a large amount of data available from other sources creating opportunities for adversaries to break the individual privacy of the users and disclose sensitive information. In this proposal, we study the mining of frequent patterns in a privacy preserving setting. We first investigate the difference between sequential and itemset patterns, and second we extend the definition of patterns by considering the absence and presence of noise in the data. This leads us in distinguishing the patterns between exact and noisy. For exact patterns, we describe two novel mining techniques that we previously developed. The first approach has been applied in a privacy preserving record linkage setting, where our solution is used to mine frequent patterns which are employed in a secure transformation procedure to link records that are similar. The second approach improves the mining utility results using a two-phase strategy which allows to effectively mine frequent substrings as well as prefixes patterns. For noisy patterns, first we formally define the patterns according to the type of noise and second we provide a set of potential applications that require the mining of these patterns. We conclude the paper by stating the challenges in this new setting and possible future research directions. © 2013 VLDB Endowment.",,Article,Final,,Scopus,2-s2.0-84891085500
"Bonomi, L.; Xiong, L.; Chen, R.; Fung, B.C.M.","Bonomi, Luca (55522738500); Xiong, Li (47461765600); Chen, Rui (57149094800); Fung, Benjamin C.M. (9737587400)",55522738500; 47461765600; 57149094800; 9737587400,Frequent grams based embedding for privacy preserving record linkage,2012,ACM International Conference Proceeding Series,,,,1597,1601,33,10.1145/2396761.2398480,https://www.scopus.com/inward/record.uri?eid=2-s2.0-84871100918&doi=10.1145%2F2396761.2398480&partnerID=40&md5=1e84e85c2d690288571af02320a6075b,"In this paper, we study the problem of privacy preserving record linkage which aims to perform record linkage without revealing anything about the non-linked records. We propose a new secure embedding strategy based on frequent variable length grams which allows record linkage on the embedded space. The frequent grams used for constructing the embedding base are mined from the original database under the framework of differential privacy. Compared with the state-of-the-art secure matching schema [15], our approach provides formal, provable privacy guarantees and achieves better scalability while providing comparable utility. © 2012 ACM.",differential privacy; privacy; record linkage; security,Conference paper,Final,,Scopus,2-s2.0-84871100918
