Authors,Author full names,Author(s) ID,Title,Year,Source title,Volume,Issue,Art. No.,Page start,Page end,Cited by,DOI,Link,Abstract,Author Keywords,Document Type,Publication Stage,Open Access,Source,EID
"Chandler, P.D.; Clark, C.R.; Zhou, G.; Noel, N.L.; Achilike, C.; Mendez, L.; Ramirez, A.H.; Loperena-Cortes, R.; Mayo, K.; Gross Cohn, E.; Ohno-Machado, L.; Boerwinkle, E.; Cicek, M.; Qian, J.; Schully, S.; Ratsimbazafy, F.; Mockrin, S.; Gebo, K.; Dedier, J.J.; Murphy, S.N.; Smoller, J.W.; Karlson, E.W.; Ahsan, H.; Ajayi, T.; Alonso, A.; Arora, A.; Aschebrook-Kilfoy, B.; Baxter, S.L.; Billheimer, D.; Bleeker, E.R.; Bonomi, L.; Carrasquillo, O.; Chen, Q.; Chesla, D.; Craver, A.; Dastur, Z.; Study/PRIDEnet, T.P.; Ehiri, J.; Epstein, M.M.; Feng, X.; Flentje, A.; Project, A.H.; Garber, L.; Giangreco, N.; Guo, Y.; Hiatt, R.A.; Ho, K.Y.; Ho, J.; Hogan, W.; Hripcsak, G.; Hunt, C.; Isai, R.; Jiang, X.; Johnson, C.C.; Jordan, K.; Joseph, C.L.; Kamel, H.; Kames, J.H.; Keegan, T.H.; Kim, K.; Kim, K.K.; Kim, J.; King, P.; Klimentidis, Y.C.; Krön, I.L.; Kuo, T.-T.; Lam, H.; Lash, J.P.; Lubensky, M.E.; Lunn, M.R.; Lussier, Y.A.; McCauley, J.L.; Meller, R.; Meyers, D.A.; Montanex Valverde, R.A.; Vogel, J.L.M.; Nagar, S.D.; Natarajan, K.; Obedin-Maliver, J.; Paul, P.; Pawloski, P.A.; Peltz-Rauchman, C.; Pemu, P.; Randal, F.T.; Rescate, A.; Ricardo, A.C.; Ross, M.E.; Roth-Manning, B.; Saranadasa, M.; Shang, N.; Spencer, E.G.; Springer, C.; Stevens, A.; Subbian, V.; Tang, A.; Trousdale, R.K.; Waalen, J.; Waring, S.; Weng, C.; White, L.","Chandler, Paulette D. (55626061900); Clark, Cheryl R. (23468415000); Zhou, Guohai (56233697400); Noel, Nyia L. (57210151757); Achilike, Confidence (57211944230); Mendez, Lizette (59628704000); Ramirez, Andrea H. (36017516700); Loperena-Cortes, Roxana (57222563379); Mayo, Kelsey R. (57221540462); Gross Cohn, Elizabeth Gross (27168859000); Ohno-Machado, Lucila (7005192335); Boerwinkle, Eric A. (7102087489); Cicek, Mine S. (7004621950); Qian, Jun (56406593800); Schully, Sheri Dixon (8839523200); Ratsimbazafy, Francis (57221542166); Mockrin, Stephen C. (6602821790); Gebo, Kelly A. (7003333145); Dedier, Julien J. (6602283938); Murphy, Shawn N. (7402778470); Smoller, Jordan Wassertheil (7006674071); Karlson, Elizabeth W. (57204274676); Ahsan, Habibul (7005171551); Ajayi, Toluwalase A. (56118243200); Alonso, Alvaro (8908137600); Arora, Amit (60311632900); Aschebrook-Kilfoy, Briseis (37062920000); Baxter, Sally L. (57200760006); Billheimer, Dean D. (6603475429); Bleeker, Eugene R. (57225045550); Bonomi, Luca (55522738500); Carrasquillo, Olveen (6603712254); Chen, Qingxia (12786369000); Chesla, David W. (56897196400); Craver, Andrew (57510588000); Dastur, Zubin (60299344700); Study/PRIDEnet, The Pride (57225042972); Ehiri, John E. (7004179661); Epstein, Mara Meyer (36991871700); Feng, Xiaoke (57222562940); Flentje, Annesa (36714883700); Project, Alliance Health (57225056129); Garber, Lawrence D. (7004253403); Giangreco, Nicholas P. (57195370965); Guo, Yi (57225050749); Hiatt, Robert A. (7006814258); Ho, Kai Yin (57225042307); Ho, Joyce (23090934600); Hogan, William R. (7101782257); Hripcsak, George M. (7004471151); Hunt, Carolyn (57225052969); Isai, Rosario (57225048219); Jiang, Xinzhuo (57225036496); Johnson, Christine C. (59117805000); Jordan, King (57225810290); Joseph, Christine L.M. (35557685300); Kamel, Hooman (35085093700); Kames, Jason H. (57225034656); Keegan, Theresa H.M. (7003556719); Kim, Karen E. (54391361200); Kim, Katherine K. (55762789200); Kim, Jihoon (57196169701); King, Paula (59597083300); Klimentidis, Yann C. (15081086900); Krön, Irving Louis (7103325917); Kuo, Tsung-Ting (36483066900); Lam, Helen Y. (56034604200); Lash, James Phillip (7005726104); Lubensky, Micah E. (55638748700); Lunn, Mitchell R. (8967960400); Lussier, Yves A. (7004101223); McCauley, Jacob L. (8151428300); Meller, Robert (7006616446); Meyers, Deborah A. (35379965900); Montanex Valverde, Raul A. (57225033009); Vogel, Julia L.Moore (57208632091); Nagar, Shashwat Deepali (57189471472); Natarajan, Kartnik (59853189800); Obedin-Maliver, Juno (51764392500); Paul, Paulina (56251166000); Pawloski, Pamela A. (53064367200); Peltz-Rauchman, Cathryn D. (57194449097); Pemu, Priscilla Igho (9250702400); Randal, Fomessa T. (58507073200); Rescate, Ana (57225053430); Ricardo, Ana Catherine (35739112800); Ross, Margaret Elizabeth (7403661996); Roth-Manning, Brittney (57225035464); Saranadasa, Madhi (36242424200); Shang, Ning (56293164100); Spencer, Emily G. (59271408100); Springer, Cassie (57222563239); Stevens, Alan B. (7202107890); Subbian, Vignesh (55346447500); Tang, Amy (57211435525); Trousdale, Rhonda K. (57213957501); Waalen, Jill M. (7003612843); Waring, Stephen C. (7004259388); Weng, Chunhua (54887805800); White, Lisa (57225050041)",55626061900; 23468415000; 56233697400; 57210151757; 57211944230; 59628704000; 36017516700; 57222563379; 57221540462; 27168859000; 7005192335; 7102087489; 7004621950; 56406593800; 8839523200; 57221542166; 6602821790; 7003333145; 6602283938; 7402778470; 7006674071; 57204274676; 7005171551; 56118243200; 8908137600; 60311632900; 37062920000; 57200760006; 6603475429; 57225045550; 55522738500; 6603712254; 12786369000; 56897196400; 57510588000; 60299344700; 57225042972; 7004179661; 36991871700; 57222562940; 36714883700; 57225056129; 7004253403; 57195370965; 57225050749; 7006814258; 57225042307; 23090934600; 7101782257; 7004471151; 57225052969; 57225048219; 57225036496; 59117805000; 57225810290; 35557685300; 35085093700; 57225034656; 7003556719; 54391361200; 55762789200; 57196169701; 59597083300; 15081086900; 7103325917; 36483066900; 56034604200; 7005726104; 55638748700; 8967960400; 7004101223; 8151428300; 7006616446; 35379965900; 57225033009; 57208632091; 57189471472; 59853189800; 51764392500; 56251166000; 53064367200; 57194449097; 9250702400; 58507073200; 57225053430; 35739112800; 7403661996; 57225035464; 36242424200; 56293164100; 59271408100; 57222563239; 7202107890; 55346447500; 57211435525; 57213957501; 7003612843; 7004259388; 54887805800; 57225050041,Hypertension prevalence in the All of Us Research Program among groups traditionally underrepresented in medical research,2021,Scientific Reports,11,1,12849,,,15,10.1038/s41598-021-92143-w,https://www.scopus.com/inward/record.uri?eid=2-s2.0-85109024727&doi=10.1038%2Fs41598-021-92143-w&partnerID=40&md5=a9d234b54380d3ae1ed996c55edcc99d,"The All of Us Research Program was designed to enable broad-based precision medicine research in a cohort of unprecedented scale and diversity. Hypertension (HTN) is a major public health concern. The validity of HTN data and definition of hypertension cases in the All of Us (AoU) Research Program for use in rule-based algorithms is unknown. In this cross-sectional, population-based study, we compare HTN prevalence in the AoU Research Program to HTN prevalence in the 2015–2016 National Health and Nutrition Examination Survey (NHANES). We used AoU baseline data from patient (age ≥ 18) measurements (PM), surveys, and electronic health record (EHR) blood pressure measurements. We retrospectively examined the prevalence of HTN in the EHR cohort using Systemized Nomenclature of Medicine (SNOMED) codes and blood pressure medications recorded in the EHR. We defined HTN as the participant having at least 2 HTN diagnosis/billing codes on separate dates in the EHR data AND at least one HTN medication. We calculated an age-standardized HTN prevalence according to the age distribution of the U.S. Census, using 3 groups (18–39, 40–59, and ≥ 60). Among the 185,770 participants enrolled in the AoU Cohort (mean age at enrollment = 51.2 years) available in a Researcher Workbench as of October 2019, EHR data was available for at least one SNOMED code from 112,805 participants, medications for 104,230 participants, and 103,490 participants had both medication and SNOMED data. The total number of persons with SNOMED codes on at least two distinct dates and at least one antihypertensive medication was 33,310 for a crude prevalence of HTN of 32.2%. AoU age-adjusted HTN prevalence was 27.9% using 3 groups compared to 29.6% in NHANES. The AoU cohort is a growing source of diverse longitudinal data to study hypertension nationwide and develop precision rule-based algorithms for use in hypertension treatment and prevention research. The prevalence of hypertension in this cohort is similar to that in prior population-based surveys. © 2021, The Author(s).",,Article,Final,All Open Access; Gold Open Access; Green Accepted Open Access; Green Open Access,Scopus,2-s2.0-85109024727
"Baxter, S.L.; Saseendrakumar, B.R.; Paul, P.; Kim, J.; Bonomi, L.; Kuo, T.-T.; Loperena, R.; Ratsimbazafy, F.; Boerwinkle, E.; Cicek, M.; Clark, C.R.; Gross Cohn, E.; Gebo, K.; Mayo, K.; Mockrin, S.; Schully, S.; Ramirez, A.H.; Ohno-Machado, L.","Baxter, Sally L. (57200760006); Saseendrakumar, Bharanidharan Radha (57219012314); Paul, Paulina (56251166000); Kim, Jihoon (60385202300); Bonomi, Luca (55522738500); Kuo, Tsung-Ting (36483066900); Loperena, Roxana (38661585300); Ratsimbazafy, Francis (57221542166); Boerwinkle, Eric A. (7102087489); Cicek, Mine S. (7004621950); Clark, Cheryl R. (23468415000); Gross Cohn, Elizabeth Gross (27168859000); Gebo, Kelly A. (7003333145); Mayo, Kelsey R. (57221540462); Mockrin, Stephen C. (6602821790); Schully, Sheri Dixon (8839523200); Ramirez, Andrea H. (36017516700); Ohno-Machado, Lucila (7005192335)",57200760006; 57219012314; 56251166000; 60385202300; 55522738500; 36483066900; 38661585300; 57221542166; 7102087489; 7004621950; 23468415000; 27168859000; 7003333145; 57221540462; 6602821790; 8839523200; 36017516700; 7005192335,Predictive Analytics for Glaucoma Using Data From the All of Us Research Program,2021,American Journal of Ophthalmology,227,,,74,86,48,10.1016/j.ajo.2021.01.008,https://www.scopus.com/inward/record.uri?eid=2-s2.0-85104476361&doi=10.1016%2Fj.ajo.2021.01.008&partnerID=40&md5=fcc7b15f77f59191ae4f328d5b4a77d2,"Purpose: To (1) use All of Us (AoU) data to validate a previously published single-center model predicting the need for surgery among individuals with glaucoma, (2) train new models using AoU data, and (3) share insights regarding this novel data source for ophthalmic research. Design: Development and evaluation of machine learning models. Methods: Electronic health record data were extracted from AoU for 1,231 adults diagnosed with primary open-angle glaucoma. The single-center model was applied to AoU data for external validation. AoU data were then used to train new models for predicting the need for glaucoma surgery using multivariable logistic regression, artificial neural networks, and random forests. Five-fold cross-validation was performed. Model performance was evaluated based on area under the receiver operating characteristic curve (AUC), accuracy, precision, and recall. Results: The mean (standard deviation) age of the AoU cohort was 69.1 (10.5) years, with 57.3% women and 33.5% black, significantly exceeding representation in the single-center cohort (P = .04 and P < .001, respectively). Of 1,231 participants, 286 (23.2%) needed glaucoma surgery. When applying the single-center model to AoU data, accuracy was 0.69 and AUC was only 0.49. Using AoU data to train new models resulted in superior performance: AUCs ranged from 0.80 (logistic regression) to 0.99 (random forests). Conclusions: Models trained with national AoU data achieved superior performance compared with using single-center data. Although AoU does not currently include ophthalmic imaging, it offers several strengths over similar big-data sources such as claims data. AoU is a promising new data source for ophthalmic research. © 2021",,Article,Final,All Open Access; Green Accepted Open Access; Green Open Access; Hybrid Gold Open Access,Scopus,2-s2.0-85104476361
"Bonomi, L.; Fan, L.; Jiang, X.","Bonomi, Luca (55522738500); Fan, Liyue (57094441400); Jiang, Xiaoqian (59051718600)",55522738500; 57094441400; 59051718600,Noise-tolerant similarity search in temporal medical data,2021,Journal of Biomedical Informatics,113,,103667,,,5,10.1016/j.jbi.2020.103667,https://www.scopus.com/inward/record.uri?eid=2-s2.0-85099222836&doi=10.1016%2Fj.jbi.2020.103667&partnerID=40&md5=0a7b1e3064b174f584542e726614dbd6,"Temporal medical data are increasingly integrated into the development of data-driven methods to deliver better healthcare. Searching such data for patterns can improve the detection of disease cases and facilitate the design of preemptive interventions. For example, specific temporal patterns could be used to recognize low-prevalence diseases, which are often under-diagnosed. However, searching these patterns in temporal medical data is challenging, as the data are often noisy, complex, and large in scale. In this work, we propose an effective and efficient solution to search for patients who exhibit conditions that resemble the input query. In our solution, we propose a similarity notion based on the Longest Common Subsequence (LCSS), which is used to measure the similarity between the query and the patient's temporal medical data and to ensure robustness against noise in the data. Our solution adopts locality sensitive hashing techniques to address the high dimensionality of medical data, by embedding the recorded clinical events (e.g., medications and diagnosis codes) into compact signatures. To perform pattern search in large EHR datasets, we propose a filtering approach based on tandem patterns, which effectively identifies candidate matches while discarding irrelevant data. The evaluations conducted using a real-world dataset demonstrate that our solution is highly accurate while significantly accelerating the similarity search. © 2020 Elsevier Inc.",EHR data; Pattern search; Similarity search; Temporal medical data,Article,Final,All Open Access; Green Accepted Open Access; Green Open Access,Scopus,2-s2.0-85099222836
"Bonomi, L.; Huang, Y.; Ohno-Machado, L.","Bonomi, Luca (55522738500); Huang, Yingxiang (57215852089); Ohno-Machado, Lucila (7005192335)",55522738500; 57215852089; 7005192335,Privacy challenges and research opportunities for genomic data sharing,2020,Nature Genetics,52,7,,646,654,226,10.1038/s41588-020-0651-0,https://www.scopus.com/inward/record.uri?eid=2-s2.0-85087035396&doi=10.1038%2Fs41588-020-0651-0&partnerID=40&md5=365bd6636d5fd6f5a96b2ac0861e290c,"The sharing of genomic data holds great promise in advancing precision medicine and providing personalized treatments and other types of interventions. However, these opportunities come with privacy concerns, and data misuse could potentially lead to privacy infringement for individuals and their blood relatives. With the rapid growth and increased availability of genomic datasets, understanding the current genome privacy landscape and identifying the challenges in developing effective privacy-protecting solutions are imperative. In this work, we provide an overview of major privacy threats identified by the research community and examine the privacy challenges in the context of emerging direct-to-consumer genetic-testing applications. We additionally present general privacy-protection techniques for genomic data sharing and their potential applications in direct-to-consumer genomic testing and forensic analyses. Finally, we discuss limitations in current privacy-protection methods, highlight possible mitigation strategies and suggest future research opportunities for advancing genomic data sharing. © 2020, Springer Nature America, Inc.",,Review,Final,All Open Access; Green Accepted Open Access; Green Open Access,Scopus,2-s2.0-85087035396
"Wang, S.; Bonomi, L.; Dai, W.; Chen, F.; Cheung, C.; Bloss, C.S.; Cheng, S.; Jiang, X.","Wang, Shuang (55796493600); Bonomi, Luca (55522738500); Dai, Wenrui (24723796900); Chen, Feng (56714193200); Cheung, Cynthia (57191910874); Bloss, Cinnamon S. (35725075100); Cheng, Samuel S. (35752985300); Jiang, Xiaoqian (59051718600)",55796493600; 55522738500; 24723796900; 56714193200; 57191910874; 35725075100; 35752985300; 59051718600,Big Data Privacy in Biomedical Research,2020,IEEE Transactions on Big Data,6,2,7565504,296,308,30,10.1109/TBDATA.2016.2608848,https://www.scopus.com/inward/record.uri?eid=2-s2.0-85089763719&doi=10.1109%2FTBDATA.2016.2608848&partnerID=40&md5=40ce74a848b3ed0543a95d33a7c60f72,"Biomedical research often involves studying patient data that contain personal information. Inappropriate use of these data might lead to leakage of sensitive information, which can put patient privacy at risk. The problem of preserving patient privacy has received increasing attentions in the era of big data. Many privacy methods have been developed to protect against various attack models. This paper reviews relevant topics in the context of biomedical research. We discuss privacy preserving technologies related to (1) record linkage, (2) synthetic data generation, and (3) genomic data privacy. We also discuss the ethical implications of big data privacy in biomedicine and present challenges in future research directions for improving data privacy in biomedical research. © 2015 IEEE.",bioethics; Biomedical research; data privacy; data security; genome analysis,Article,Final,All Open Access; Green Accepted Open Access; Green Open Access,Scopus,2-s2.0-85089763719
"Bonomi, L.; Jiang, X.; Ohno-Machado, L.","Bonomi, Luca (55522738500); Jiang, Xiaoqian (59051718600); Ohno-Machado, Lucila (7005192335)",55522738500; 59051718600; 7005192335,Protecting patient privacy in survival analyses,2020,Journal of the American Medical Informatics Association,27,3,,366,375,21,10.1093/jamia/ocz195,https://www.scopus.com/inward/record.uri?eid=2-s2.0-85079352504&doi=10.1093%2Fjamia%2Focz195&partnerID=40&md5=624af3c6d35aaf04eaa29d65fed1908c,"Objective: Survival analysis is the cornerstone of many healthcare applications in which the ""survival"" probability (eg, time free from a certain disease, time to death) of a group of patients is computed to guide clinical decisions. It is widely used in biomedical research and healthcare applications. However, frequent sharing of exact survival curves may reveal information about the individual patients, as an adversary may infer the presence of a person of interest as a participant of a study or of a particular group. Therefore, it is imperative to develop methods to protect patient privacy in survival analysis. Materials and Methods: We develop a framework based on the formal model of differential privacy, which provides provable privacy protection against a knowledgeable adversary. We show the performance of privacy-protecting solutions for the widely used Kaplan-Meier nonparametric survival model. Results: We empirically evaluated the usefulness of our privacy-protecting framework and the reduced privacy risk for a popular epidemiology dataset and a synthetic dataset. Results show that our methods significantly reduce the privacy risk when compared with their nonprivate counterparts, while retaining the utility of the survival curves. Discussion: The proposed framework demonstrates the feasibility of conducting privacy-protecting survival analyses. We discuss future research directions to further enhance the usefulness of our proposed solutions in biomedical research applications. Conclusion: The results suggest that our proposed privacy-protection methods provide strong privacy protections while preserving the usefulness of survival analyses. © 2019 The Author(s) 2019. Published by Oxford University Press on behalf of the American Medical Informatics Association. All rights reserved.",actuarial; data privacy; data sharing; Kaplan-Meier; survival analysis,Article,Final,All Open Access; Green Accepted Open Access; Green Open Access,Scopus,2-s2.0-85079352504
"Bonomi, L.; Jiang, X.","Bonomi, Luca (55522738500); Jiang, Xiaoqian (59051718600)",55522738500; 59051718600,Linking temporal medical records using non-protected health information data,2018,Statistical Methods in Medical Research,27,11,,3304,3324,4,10.1177/0962280217698005,https://www.scopus.com/inward/record.uri?eid=2-s2.0-85043703654&doi=10.1177%2F0962280217698005&partnerID=40&md5=a2d5992025508d217aa54658adc5149d,"Modern medical research relies on multi-institutional collaborations which enhance the knowledge discovery and data reuse. While these collaborations allow researchers to perform analytics otherwise impossible on individual datasets, they often pose significant challenges in the data integration process. Due to the lack of a unique identifier, data integration solutions often have to rely on patient’s protected health information (PHI). In many situations, such information cannot leave the institutions or must be strictly protected. Furthermore, the presence of noisy values for these attributes may result in poor overall utility. While much research has been done to address these challenges, most of the current solutions are designed for a static setting without considering the temporal information of the data (e.g. EHR). In this work, we propose a novel approach that uses non-PHI for linking patient longitudinal data. Specifically, our technique captures the diagnosis dependencies using patterns which are shown to provide important indications for linking patient records. Our solution can be used as a standalone technique to perform temporal record linkage using non-protected health information data or it can be combined with Privacy Preserving Record Linkage solutions (PPRL) when protected health information is available. In this case, our approach can solve ambiguities in results. Experimental evaluations on real datasets demonstrate the effectiveness of our technique. © The Author(s) 2017.",data mining; EHR data; Record linkage; sequential patterns; temporal data,Article,Final,All Open Access; Green Accepted Open Access; Green Open Access,Scopus,2-s2.0-85043703654
"Fan, L.; Bonomi, L.; Shahabi, C.; Xiong, L.","Fan, Liyue (57094441400); Bonomi, Luca (55522738500); Shahabi, Cyrus (7004263107); Xiong, Li (47461765600)",57094441400; 55522738500; 7004263107; 47461765600,Optimal group route query: Finding itinerary for group of users in spatial databases,2018,GeoInformatica,22,4,,845,867,9,10.1007/s10707-018-0331-8,https://www.scopus.com/inward/record.uri?eid=2-s2.0-85055336435&doi=10.1007%2Fs10707-018-0331-8&partnerID=40&md5=adccacb52e8ee5c2bb2b5994d857e4de,"The increasing popularity of location-based applications creates new opportunities for users to travel together. In this paper, we study a novel spatio-social optimization problem , i.e., Optimal Group Route, for multi-user itinerary planning. With our problem formulation, users can individually specify sources and destinations, preferences on the Point-of-interest (POI) categories, as well as the distance constraints. The goal is to find a itinerary that can be traversed by all the users while maximizing the group’s preference of POI categories in the itinerary. Our work advances existing group trip planning studies by maximizing the group’s social experience. To this end, individual preferences of POI categories are aggregated by considering the agreement and disagreement among group members. Furthermore, planning a multi-user itinerary on large road networks is computationally challenging. We propose two efficient greedy algorithms with bounded approximation ratio, one exact solution which computes the optimal itinerary by exploring a limited number of paths in the road network, and a scaled approximation algorithm to speed up the dynamic programming employed by the exact solution. We conduct extensive empirical evaluations on two real-world road network/POI datasets and our results confirm the effectiveness and efficiency of our solutions. © 2018, Springer Science+Business Media, LLC, part of Springer Nature.",Optimization; Route planning; Social trip,Article,Final,,Scopus,2-s2.0-85055336435
"Fan, L.; Bonomi, L.","Fan, Liyue (57094441400); Bonomi, Luca (55522738500)",57094441400; 55522738500,Time Series Sanitization with Metric-Based Privacy,2018,"Proceedings - 2018 IEEE International Congress on Big Data, BigData Congress 2018 - Part of the 2018 IEEE World Congress on Services",,,8457763,264,267,8,10.1109/BigDataCongress.2018.00047,https://www.scopus.com/inward/record.uri?eid=2-s2.0-85057716276&doi=10.1109%2FBigDataCongress.2018.00047&partnerID=40&md5=9086753cb15486265cb5c622721e8d7e,"The increasing popularity of connected devices has given rise to the vast generation of time series data. Due to consumer privacy concerns, the data collected from individual devices must be sanitized before sharing with untrusted third-parties. However, existing time series privacy solutions do not provide provable guarantees for individual time series and may not extend to data from a wide range of application domains. In this paper, we adopt a generalized privacy notion based on differential privacy for individual time series sanitization and Discrete Cosine Transform to model the characteristics of time series data. We extend previously reported 2-dimensional results to arbitrary k-dimensional space. Empirical evaluation with various datasets demonstrates the applicability of our proposed method with the standard mean squared error (MSE) and in classification tasks. © 2018 IEEE.",Differential Privacy; Sampling; Time Series,Conference paper,Final,,Scopus,2-s2.0-85057716276
