Authors,Author full names,Author(s) ID,Title,Year,Source title,Volume,Issue,Art. No.,Page start,Page end,Cited by,DOI,Link,Abstract,Author Keywords,Document Type,Publication Stage,Open Access,Source,EID
"Deng, R.; Cui, C.; Remedios, L.W.; Bao, S.; Womick, R.M.; Chiron, S.; Li, J.; Roland, J.T.; Lau, K.S.; Liu, Q.; Wilson, K.T.; Wang, Y.; Coburn, L.A.; Landman, B.A.; Huo, Y.","Deng, Ruining (57219448253); Cui, Can (57219469236); Remedios, Lucas W. (57226830336); Bao, Shunxing (57189987093); Womick, R. Michael (57786748800); Chiron, Sophie (57222559307); Li, Jia (57223877581); Roland, Joseph T. (8094809800); Lau, Ken S. (7401560116); Liu, Qi (57071806700); Wilson, Keith Tucker (57202597534); Wang, Yaohong (55734196100); Coburn, Lori A. (6603410655); Landman, Bennett Allan (16679175200); Huo, Yuankai (56830058500)",57219448253; 57219469236; 57226830336; 57189987093; 57786748800; 57222559307; 57223877581; 8094809800; 7401560116; 57071806700; 57202597534; 55734196100; 6603410655; 16679175200; 56830058500,Cross-Scale Attention Guided Multi-instance Learning for Crohn’s Disease Diagnosis with Pathological Images,2022,Lecture Notes in Computer Science (including subseries Lecture Notes in Artificial Intelligence and Lecture Notes in Bioinformatics),13594 LNCS,,,24,33,10,10.1007/978-3-031-18814-5_3,https://www.scopus.com/inward/record.uri?eid=2-s2.0-85141836451&doi=10.1007%2F978-3-031-18814-5_3&partnerID=40&md5=a555d7f4fbfa6e46f587594b101ed27b,"Multi-instance learning (MIL) is widely used in the computer-aided interpretation of pathological Whole Slide Images (WSIs) to solve the lack of pixel-wise or patch-wise annotations. Often, this approach directly applies “natural image driven” MIL algorithms which overlook the multi-scale (i.e. pyramidal) nature of WSIs. Off-the-shelf MIL algorithms are typically deployed on a single-scale of WSIs (e.g., 20 × magnification), while human pathologists usually aggregate the global and local patterns in a multi-scale manner (e.g., by zooming in and out between different magnifications). In this study, we propose a novel cross-scale attention mechanism to explicitly aggregate inter-scale interactions into a single MIL network for Crohn’s Disease (CD), which is a form of inflammatory bowel disease. The contribution of this paper is two-fold: (1) a cross-scale attention mechanism is proposed to aggregate features from different resolutions with multi-scale interaction; and (2) differential multi-scale attention visualizations are generated to localize explainable lesion patterns. By training ∼ 250,000 H &E-stained Ascending Colon (AC) patches from 20 CD patient and 30 healthy control samples at different scales, our approach achieved a superior Area under the Curve (AUC) score of 0.8924 compared with baseline models. The official implementation is publicly available at https://github.com/hrlblab/CS-MIL. © 2022, The Author(s), under exclusive license to Springer Nature Switzerland AG.",Attention mechanism; Multi-instance Learning; Multi-scale; Pathology,Conference paper,Final,All Open Access; Green Accepted Open Access; Green Open Access,Scopus,2-s2.0-85141836451
"Cui, C.; Liu, H.; Liu, Q.; Deng, R.; Asad, Z.; Wang, Y.; Zhao, S.; Yang, H.; Landman, B.A.; Huo, Y.","Cui, Can (57219469236); Liu, Han (57279011700); Liu, Quan (57336485300); Deng, Ruining (57219448253); Asad, Zuhayr (57249905900); Wang, Yaohong (55734196100); Zhao, Shillin (56415384300); Yang, Haichun (8638224800); Landman, Bennett Allan (16679175200); Huo, Yuankai (56830058500)",57219469236; 57279011700; 57336485300; 57219448253; 57249905900; 55734196100; 56415384300; 8638224800; 16679175200; 56830058500,"Survival Prediction of Brain Cancer with Incomplete Radiology, Pathology, Genomic, and Demographic Data",2022,Lecture Notes in Computer Science (including subseries Lecture Notes in Artificial Intelligence and Lecture Notes in Bioinformatics),13435 LNCS,,,626,635,29,10.1007/978-3-031-16443-9_60,https://www.scopus.com/inward/record.uri?eid=2-s2.0-85139085424&doi=10.1007%2F978-3-031-16443-9_60&partnerID=40&md5=5435d53d65d850732d4f3211c55d135f,"Integrating cross-department multi-modal data (e.g., radiology, pathology, genomic, and demographic data) is ubiquitous in brain cancer diagnosis and survival prediction. To date, such an integration is typically conducted by human physicians (and panels of experts), which can be subjective and semi-quantitative. Recent advances in multi-modal deep learning, however, have opened a door to leverage such a process in a more objective and quantitative manner. Unfortunately, the prior arts of using four modalities on brain cancer survival prediction are limited by a “complete modalities” setting (i.e., with all modalities available). Thus, there are still open questions on how to effectively predict brain cancer survival from incomplete radiology, pathology, genomic, and demographic data (e.g., one or more modalities might not be collected for a patient). For instance, should we use both complete and incomplete data, and more importantly, how do we use such data? To answer the preceding questions, we generalize the multi-modal learning on cross-department multi-modal data to a missing data setting. Our contribution is three-fold: 1) We introduce a multi-modal learning with missing data (MMD) pipeline with competitive performance and less hardware consumption; 2) We extend multi-modal learning on radiology, pathology, genomic, and demographic data into missing data scenarios; 3) A large-scale public dataset (with 962 patients) is collected to systematically evaluate glioma tumor survival prediction using four modalities. The proposed method improved the C-index of survival prediction from 0.7624 to 0.8053. © 2022, The Author(s), under exclusive license to Springer Nature Switzerland AG.",Missing modalities; Multi-modal learning; Survival prediction,Conference paper,Final,,Scopus,2-s2.0-85139085424
"Bao, S.; Li, J.; Cui, C.; Tang, Y.; Deng, R.; Remedios, L.W.; Lee, H.H.; Chiron, S.; Patterson, N.H.; Lau, K.S.; Coburn, L.A.; Wilson, K.T.; Roland, J.T.; Landman, B.A.; Liu, Q.; Huo, Y.","Bao, Shunxing (57189987093); Li, Jia (57223877581); Cui, Can (57219469236); Tang, Yucheng (57212614566); Deng, Ruining (57219448253); Remedios, Lucas W. (57226830336); Lee, Hohin (57219409783); Chiron, Sophie (57222559307); Patterson, Nathan Heath (55555923300); Lau, Ken S. (7401560116); Coburn, Lori A. (6603410655); Wilson, Keith Tucker (57202597534); Roland, Joseph T. (8094809800); Landman, Bennett Allan (16679175200); Liu, Qi (57071806700); Huo, Yuankai (56830058500)",57189987093; 57223877581; 57219469236; 57212614566; 57219448253; 57226830336; 57219409783; 57222559307; 55555923300; 7401560116; 6603410655; 57202597534; 8094809800; 16679175200; 57071806700; 56830058500,MxIF Q-score: Biology-Informed Quality Assurance for Multiplexed Immunofluorescence Imaging,2022,Lecture Notes in Computer Science (including subseries Lecture Notes in Artificial Intelligence and Lecture Notes in Bioinformatics),13578 LNCS,,,42,52,3,10.1007/978-3-031-16961-8_5,https://www.scopus.com/inward/record.uri?eid=2-s2.0-85138791082&doi=10.1007%2F978-3-031-16961-8_5&partnerID=40&md5=b8db5b14dabd8baae3faaf47be6b33bc,"Medical image processing and analysis on whole slide imaging (WSI) are notoriously difficult due to its giga-pixel high-resolution nature. Multiplex immunofluorescence (MxIF), a spatial single-cell level iterative imaging technique that collects dozens of WSIs on the same histological tissue, makes the data analysis an order of magnitude more complicated. The rigor of downstream single-cell analyses (e.g., cell type annotation) depends on the quality of the image processing (e.g., multi-WSI alignment and cell segmentation). Unfortunately, the high-resolutional and high-dimensional nature of MxIF data prevent the researchers from performing comprehensive data curations manually, thus leads to misleading biological findings. In this paper, we propose a learning based MxIF quality score (MxIF Q-score) that integrates automatic image segmentation and single-cell clustering methods to conduct biology-informed MxIF image data curation. To the best of our knowledge, this is the first study to provide an automatic quality assurance score of MxIF image alignment and segmentation from an automatic and biological knowledge-informed standpoint. The proposed method was validated on 245 MxIF image regions of interest (ROIs) from 49 WSIs and achieved 0.99 recall and 0.86 precision when compared with manual visual check on spatial alignment validation. We present extensive experimental results to show the efficacy of the Q-score system. We conclude that a biological knowledge driven scoring framework is a promising direction of assessing the complicated MxIF data. © 2022, The Author(s), under exclusive license to Springer Nature Switzerland AG.",Data curation; MxIF; Quality assurance; scRNA-seq,Conference paper,Final,All Open Access; Green Accepted Open Access; Green Open Access,Scopus,2-s2.0-85138791082
"Liu, Q.; Cui, C.; Deng, R.; Asad, Z.; Yao, T.; Zhu, Z.; Huo, Y.","Liu, Quan (57336485300); Cui, Can (57219469236); Deng, Ruining (57219448253); Asad, Zuhayr (57249905900); Yao, Tianyuan (57222525765); Zhu, Zheyu (57219448236); Huo, Yuankai (56830058500)",57336485300; 57219469236; 57219448253; 57249905900; 57222525765; 57219448236; 56830058500,Leverage Supervised and Self-supervised Pretrain Models for Pathological Survival Analysis via a Simple and Low-cost Joint Representation Tuning,2022,Lecture Notes in Computer Science (including subseries Lecture Notes in Artificial Intelligence and Lecture Notes in Bioinformatics),13543 LNCS,,,75,84,1,10.1007/978-3-031-16876-5_8,https://www.scopus.com/inward/record.uri?eid=2-s2.0-85138780451&doi=10.1007%2F978-3-031-16876-5_8&partnerID=40&md5=7cfade246bcc5fc450afe90c381d2890,"The large-scale pretrained models from terabyte-level (TB) data are now broadly used in feature extraction, model initialization, and transfer learning in pathological image analyses. Most existing studies have focused on developing more powerful pretrained models, which are increasingly unscalable for academic institutes. Very few, if any, studies have investigated how to take advantage of existing, yet heterogeneous, pretrained models for downstream tasks. As an example, our experiments elucidated that self-supervised models (e.g., contrastive learning on the entire The Cancer Genome Atlas (TCGA) dataset) achieved a superior performance compared with supervised models (e.g., ImageNet pretraining) on a classification cohort. Surprisingly, it yielded an inferior performance when it was translated to a cancer prognosis task. Such a phenomenon inspired us to explore how to leverage the already trained supervised and self-supervised models for pathological survival analysis. In this paper, we present a simple and low-cost joint representation tuning (JRT) to aggregate task-agnostic vision representation (supervised ImageNet pretrained models) and pathological specific feature representation (self-supervised TCGA pretrained models) for downstream tasks. Our contribution is in three-fold: (1) we adapt and aggregate classification-based supervised and self-supervised representation to survival prediction via joint representation tuning, (2) comprehensive analyses on prevalent strategies of pretrained models are conducted, (3) the joint representation tuning provides a simple, yet computationally efficient, perspective to leverage large-scale pretrained models for both cancer diagnosis and prognosis. The proposed JRT method improved the c-index from 0.705 to 0.731 on the TCGA brain cancer survival dataset. The feature-direct JRT (f-JRT) method achieved 60 × training speedup while maintaining 0.707 c-index score. © 2022, The Author(s), under exclusive license to Springer Nature Switzerland AG.",Pathology; Prognosis analysis; Representation tuning; Self-supervised learning,Conference paper,Final,,Scopus,2-s2.0-85138780451
"Zhu, Z.; Deng, R.; Liu, Q.; Asad, Z.; Cui, C.; Yao, T.; Huo, Y.","Zhu, Zheyu (57219448236); Deng, Ruining (57219448253); Liu, Quan (57336485300); Asad, Zuhayr (57249905900); Cui, Can (57219469236); Yao, Tianyuan (57222525765); Huo, Yuankai (56830058500)",57219448236; 57219448253; 57336485300; 57249905900; 57219469236; 57222525765; 56830058500,Large-Scale Patch-Wise Pathological Image Feature Dataset with a Hardware-agnostic Feature Extraction Tool,2022,Lecture Notes in Computer Science (including subseries Lecture Notes in Artificial Intelligence and Lecture Notes in Bioinformatics),13413 LNCS,,,778,786,0,10.1007/978-3-031-12053-4_57,https://www.scopus.com/inward/record.uri?eid=2-s2.0-85135935106&doi=10.1007%2F978-3-031-12053-4_57&partnerID=40&md5=05b754101031b78cf3f0709bdb27cd1c,"Recent advances in whole slide imaging (WSI) have transformed computer-aided pathological studies from small-scale (e.g., &lt;500 patients) to large-scale (e.g., &gt;10,000 patients). Moreover, a single whole slide image might yield Gigapixel resolution; thus, even basic preprocessing steps, such as foreground segmentation, tiling, and patch-wise feature extraction (e.g., via ImageNet pretrained models), can be computationally expensive. For example, it would take 2,400 h to simply obtain patch-level low-dimensional features (e.g., 1D feature with 2048 dimension) from all foreground patches (e.g., 512 × 512 images) in 10,000 WSI images. In this paper, we present a large-scale patch-wise pathological image feature dataset, covering 14,000 WSIs from TCGA and PAIP cohorts. The contribution of this study is five-fold: (1) We release a foreground patch-level feature dataset, saving 92.1% of storage space and 140 days of computational time; (2) The global spatial location of the patch-level features is provided to aggregate WSI-level results; (3) The feature dataset from two pretrained models (ImageNet and BiT) and two resolutions (1024 and 2048) are evaluated and released for flexible downstream analyses; (4) We containerize the foreground segmentation, tiling, and feature extraction steps as an operating system and hardware agnostic Docker toolkit, called PathContainer, to allow for convenient feature extraction; (5) The entire PathFeature dataset and the PathContainer software have been made publicly available. When performing a standard weakly supervised segmentation method on 940 WSIs, 85.3% of computational time was saved using the PathFeature dataset. The code and data have been made publicly available at https://github.com/hrlblab/PathContainer. © 2022, The Author(s), under exclusive license to Springer Nature Switzerland AG.",Computational pathology; Feature extraction; Weakly supervised learning,Conference paper,Final,,Scopus,2-s2.0-85135935106
"Yao, T.; Lu, Y.; Deng, R.; Zhu, Z.; Asad, Z.; Yang, H.; Wheless, L.; Fogo, A.B.; Huo, Y.","Yao, Tianyuan (57222525765); Lu, Yuzhe (57219452992); Deng, Ruining (57219448253); Zhu, Zheyu (57219448236); Asad, Zuhayr (57249905900); Yang, Haichun (8638224800); Wheless, Lee E. (8146830500); Fogo, Agnes B. (7102673654); Huo, Yuankai (56830058500)",57222525765; 57219452992; 57219448253; 57219448236; 57249905900; 8638224800; 8146830500; 7102673654; 56830058500,Self-supervised learning with large-scale web image mining for characterizing glomerular lesions,2022,Progress in Biomedical Optics and Imaging - Proceedings of SPIE,12039,,120390R,,,0,10.1117/12.2611903,https://www.scopus.com/inward/record.uri?eid=2-s2.0-85132843117&doi=10.1117%2F12.2611903&partnerID=40&md5=90f5a6e4faec4467877d287747f0a204,"Glomeruli are clusters of capillaries that are responsible for filtering the blood to form urine, thus excreting waste and maintaining fluid and acid-base balance. The detection and characterization of glomeruli are key elements in diagnostic and experimental nephropathology. Although the field of machine vision has already advanced the detection, classification, and prognostication of diseases in the specialties of radiology and oncology, renal pathology is just entering the digital imaging era. However, developing quantitative machine learning approaches (e.g., self-supervised deep learning) that characterize glomerular lesions (e.g., global glomerulosclerosis (GGS)) from whole slide images (WSIs) typically requires large-scale heterogeneous images, which is resource extensive for individual labs. In this study, we assess the feasibility of leveraging fine-grained GGS characterization via large-scale web image mining (e.g., from journals, search engines, websites) and self-supervised deep learning. Three types of GGS were assessed-solidified (S-GGS, associated with hypertension-related injury), disappearing (D-GGS, a further end result of the SGGS becoming contiguous with fibrotic interstitium), and obsolescent (O-GGS, nonspecific GGS increasing with aging). We employed the SimSiam network as the baseline method of self-supervised contrastive learning. By deploying our previously developed compound figure separation approach, we provided 30,000 unannotated glomerular images via web image mining to train the SimSiam network. From the results, the GGS fine-grained classification model achieved superior performance compared with baseline methods. The segmentation networks evaluated across six different resolutions © COPYRIGHT SPIE.",Classification; Global Glomerulosclerosis; Self-supervised learning,Conference paper,Final,,Scopus,2-s2.0-85132843117
"Deng, R.; Yang, H.; Asad, Z.; Zhu, Z.; Wang, S.; Wheless, L.; Fogo, A.B.; Huo, Y.","Deng, Ruining (57219448253); Yang, Haichun (8638224800); Asad, Zuhayr (57249905900); Zhu, Zheyu (57219448236); Wang, Shiru (57202359090); Wheless, Lee E. (8146830500); Fogo, Agnes B. (7102673654); Huo, Yuankai (56830058500)",57219448253; 8638224800; 57249905900; 57219448236; 57202359090; 8146830500; 7102673654; 56830058500,Dense multi-object 3D glomerular reconstruction and quantification on 2D serial section whole slide images,2022,Progress in Biomedical Optics and Imaging - Proceedings of SPIE,12039,,120390F,,,5,10.1117/12.2611957,https://www.scopus.com/inward/record.uri?eid=2-s2.0-85132842918&doi=10.1117%2F12.2611957&partnerID=40&md5=ef5eddf306ca1cc41a9eb6dce59d6f79,"There has been a long pursuit for precise and reproducible glomerular quantification in the field of renal pathology in both research and clinical practice. Currently, 3D glomerular identification and reconstruction of large-scale glomeruli are labor-intensive tasks, and time-consuming by manual analysis on whole slide imaging (WSI) in 2D serial sectioning representation. The accuracy of serial section analysis is also limited in the 2D serial context. Moreover, there are no approaches to present 3D glomerular visualization for human examination (volume calculation, 3D phenotype analysis, etc.). In this paper, we introduce an end-to-end holistic deep-learning-based method that achieves automatic detection, segmentation and multi-object tracking (MOT) of individual glomeruli with large-scale glomerular-registered assessment in a 3D context on WSIs. The high-resolution WSIs are the inputs, while the outputs are the 3D glomerular reconstruction and volume estimation. This pipeline achieves 81.8 in IDF1 and 69.1 in MOTA as MOT performance, while the proposed volume estimation achieves 0.84 Spearman correlation coefficient with manual annotation. The end-to-end MAP3D+ pipeline provides an approach for extensive 3D glomerular reconstruction and volume quantification from 2D serial section WSIs. © COPYRIGHT SPIE.",3D reconstruction; MOT; registration; segmentation,Conference paper,Final,All Open Access; Green Accepted Open Access; Green Open Access,Scopus,2-s2.0-85132842918
"Lu, Y.; Jha, A.; Deng, R.; Huo, Y.","Lu, Yuzhe (57219452992); Jha, Aadarsh (57219739478); Deng, Ruining (57219448253); Huo, Yuankai (56830058500)",57219452992; 57219739478; 57219448253; 56830058500,Contrastive learning meets transfer learning: A case study in medical image analysis,2022,Progress in Biomedical Optics and Imaging - Proceedings of SPIE,12033,,120332Q,,,4,10.1117/12.2610990,https://www.scopus.com/inward/record.uri?eid=2-s2.0-85132799033&doi=10.1117%2F12.2610990&partnerID=40&md5=430cdc65f3330c660777688e538ed994,"Annotated medical images are typically more rare than labeled natural images, since they are limited by domain knowledge and privacy constraints. Recent advances in transfer and contrastive learning have provided effective solutions to tackle such issues from different perspectives. The state-of-the-art transfer learning (e.g., Big Transfer (BiT)) and contrastive learning (e.g., Simple Siamese Contrastive Learning (SimSiam)) approaches have been investigated independently, without considering the complementary nature of such techniques. It would be appealing to accelerate contrastive learning with transfer learning, given that slow convergence speed is a critical limitation of modern contrastive learning approaches. In this paper, we investigate the feasibility of aligning BiT with SimSiam. From empirical analyses, different normalization techniques (Group Norm in BiT vs. Batch Norm in SimSiam) is a key hurdle of adapting BiT to SimSiam. When combining BiT with SimSiam, we evaluated the performance of using BiT, SimSiam, and BiT+SimSiam on CIFAR-10 and HAM10000 datasets. The results suggest that the BiT models accelerate the convergence speed of SimSiam. When used together, the model gives superior performance over both of its counterparts. We hope this study will motivate researchers to revisit the task of aggregating big pretrained models with contrastive learning models for image analysis. © 2022 SPIE.",BiT; Contrastive learning; SimSiam; Transfer learning,Conference paper,Final,,Scopus,2-s2.0-85132799033
"Nguyen, C.; Asad, Z.; Deng, R.; Huo, Y.","Nguyen, Cam (57249760800); Asad, Zuhayr (57249905900); Deng, Ruining (57219448253); Huo, Yuankai (56830058500)",57249760800; 57249905900; 57219448253; 56830058500,Evaluating Transformer-based Semantic Segmentation Networks for Pathological Image Segmentation,2022,Progress in Biomedical Optics and Imaging - Proceedings of SPIE,12032,,120323N,,,27,10.1117/12.2611177,https://www.scopus.com/inward/record.uri?eid=2-s2.0-85130368185&doi=10.1117%2F12.2611177&partnerID=40&md5=d1689db48018c6663c134c2e046469dd,"Histopathology has played an essential role in cancer diagnosis. With the rapid advances in convolutional neural networks (CNN), various CNN-based automated pathological image segmentation approaches have been developed in computer-assisted pathological image analysis. In the past few years, Transformer neural networks (Transformer) have shown the unique merit of capturing the global long-distance dependencies across the entire image as a new deep learning paradigm. Such merit is appealing for exploring spatially heterogeneous pathological images. However, there have been very few, if any, studies that have systematically evaluated the current Transformer-based approaches in pathological image segmentation. To assess the performance of Transformer segmentation models on whole slide images (WSI), we quantitatively evaluated six prevalent transformer-based models on tumor segmentation, using the widely used PAIP liver histopathological dataset. For a more comprehensive analysis, we also compare the transformer-based models with six major traditional CNN-based models. The results show that the Transformer-based models exhibit a general superior performance over the CNN-based models. In particular, Segmenter, Swin-Transformer and TransUNet–all transformer-based–came out as the best performers among the twelve evaluated models. © 2022 SPIE",histopathological image analysis; liver tumor segmentation; semantic segmentation; Transformer,Conference paper,Final,,Scopus,2-s2.0-85130368185
