Authors,Author full names,Author(s) ID,Title,Year,Source title,Volume,Issue,Art. No.,Page start,Page end,Cited by,DOI,Link,Abstract,Author Keywords,Document Type,Publication Stage,Open Access,Source,EID
"Li, X.; Deng, R.; Tang, Y.; Bao, S.; Yang, H.; Huo, Y.","Li, Xueyuan (58550351000); Deng, Ruining (57219448253); Tang, Yucheng (57212614566); Bao, Shunxing (57189987093); Yang, Haichun (8638224800); Huo, Yuankai (56830058500)",58550351000; 57219448253; 57212614566; 57189987093; 8638224800; 56830058500,Leverage Weakly Annotation to Pixel-wise Annotation via Zero-shot Segment Anything Model for Molecular-empowered Learning,2024,Progress in Biomedical Optics and Imaging - Proceedings of SPIE,12933,,129330K,,,3,10.1117/12.3006577,https://www.scopus.com/inward/record.uri?eid=2-s2.0-85191311332&doi=10.1117%2F12.3006577&partnerID=40&md5=b0eb5eae57e877b59113c950bb51c867,"Precise identification of multiple cell classes in high-resolution Giga-pixel whole slide imaging (WSI) is critical for various clinical scenarios. Building an AI model for this purpose typically requires pixel-level annotations, which are often unscalable and must be done by skilled domain experts (e.g., pathologists). However, these annotations can be prone to errors, especially when distinguishing between intricate cell types (e.g., podocytes and mesangial cells) using only visual inspection. Interestingly, a recent study showed that lay annotators, when using extra immunofluorescence (IF) images for reference (referred to as molecular-empowered learning), can sometimes outperform domain experts in labeling. Despite this, the resource-intensive task of manual delineation remains a necessity during the annotation process. In this paper, we explore the potential of bypassing pixel-level delineation by employing the recent segment anything model (SAM) on weak box annotation in a zero-shot learning approach. Specifically, we harness SAM’s ability to produce pixel-level annotations from box annotations and utilize these SAM-generated labels to train a segmentation model. Our findings show that the proposed SAM-assisted molecular-empowered learning (SAM-L) can diminish the labeling efforts for lay annotators by only requiring weak box annotations. This is achieved without compromising annotation accuracy or the performance of the deep learning-based segmentation. This research represents a significant advancement in democratizing the annotation process for training pathological image segmentation, relying solely on non-expert annotators. © 2024 SPIE.",Deep learning; Image annotation; Molecular-empowered learning; Pathology,Conference paper,Final,All Open Access; Green Accepted Open Access; Green Open Access,Scopus,2-s2.0-85191311332
"Chen, J.; Wang, Y.; Deng, R.; Liu, Q.; Cui, C.; Yao, T.; Liu, Y.; Zhong, J.; Fogo, A.B.; Yang, H.; Zhao, S.; Huo, Y.","Chen, Jiayuan (59002337500); Wang, Yu (55979182400); Deng, Ruining (57219448253); Liu, Quan (57336485300); Cui, Can (57219469236); Yao, Tianyuan (57222525765); Liu, Yilin (58394867100); Zhong, Jianyong (12244756000); Fogo, Agnes B. (7102673654); Yang, Haichun (8638224800); Zhao, Shillin (56415384300); Huo, Yuankai (56830058500)",59002337500; 55979182400; 57219448253; 57336485300; 57219469236; 57222525765; 58394867100; 12244756000; 7102673654; 8638224800; 56415384300; 56830058500,Spatial Pathomics Toolkit for Quantitative Analysis of Podocyte Nuclei with Histology and Spatial Transcriptomics Data in Renal Pathology,2024,Progress in Biomedical Optics and Imaging - Proceedings of SPIE,12933,,1293310,,,2,10.1117/12.3006318,https://www.scopus.com/inward/record.uri?eid=2-s2.0-85191311098&doi=10.1117%2F12.3006318&partnerID=40&md5=11545abc0568ef6335799aa6105af28e,"Podocytes, specialized epithelial cells that envelop the glomerular capillaries, play a pivotal role in maintaining renal health. The current description and quantification of features on pathology slides are limited, prompting the need for innovative solutions to comprehensively assess diverse phenotypic attributes within Whole Slide Images (WSIs). In particular, understanding the morphological characteristics of podocytes, terminally differentiated glomerular epithelial cells, is crucial for studying glomerular injury. This paper introduces the Spatial Pathomics Toolkit (SPT) and applies it to podocyte pathomics. The SPT consists of three main components: (1) instance object segmentation, enabling precise identification of podocyte nuclei; (2) pathomics feature generation, extracting a comprehensive array of quantitative features from the identified nuclei; and (3) robust statistical analyses, facilitating a comprehensive exploration of spatial relationships between morphological and spatial transcriptomics features. The SPT successfully extracted and analyzed morphological and textural features from podocyte nuclei, revealing a multitude of podocyte morphomic features through statistical analysis. Additionally, we demonstrated the SPT’s ability to unravel spatial information inherent to podocyte distribution, shedding light on spatial patterns associated with glomerular injury. By disseminating the SPT, our goal is to provide the research community with a powerful and user-friendly resource that advances cellular spatial pathomics in renal pathology. The toolkit’s implementation and its complete source code are made openly accessible at the GitHub repository: https://github.com/hrlblab/spatial_pathomics. © 2024 SPIE.",podocyte; Spatial pathomics; spatial transcriptomics; SPT,Conference paper,Final,All Open Access; Green Accepted Open Access; Green Open Access,Scopus,2-s2.0-85191311098
"Liu, Y.; Deng, R.; Xiong, J.; Tyree, R.N.; Correa, H.; Hiremath, G.; Wang, Y.; Huo, Y.","Liu, Yilin (58394867100); Deng, Ruining (57219448253); Xiong, Juming (58550762500); Tyree, Regina N. (57210803860); Correa, Hernán (36925755200); Hiremath, Girish S. (12798054500); Wang, Yaohong (55734196100); Huo, Yuankai (56830058500)",58394867100; 57219448253; 58550762500; 57210803860; 36925755200; 12798054500; 55734196100; 56830058500,Eosinophils Instance Object Segmentation on Whole Slide Imaging Using Multi-label Circle Representation,2024,Progress in Biomedical Optics and Imaging - Proceedings of SPIE,12933,,129330I,,,3,10.1117/12.3005995,https://www.scopus.com/inward/record.uri?eid=2-s2.0-85191303957&doi=10.1117%2F12.3005995&partnerID=40&md5=d9b0aa3f1817dea5d707e5460dd80f31,"Eosinophilic esophagitis (EoE) is a chronic and relapsing disease characterized by esophageal inflammation. Symptoms of EoE include difficulty swallowing, food impaction, and chest pain which significantly impact the quality of life, resulting in nutritional impairments, social limitations, and psychological distress. The diagnosis of EoE is typically performed with a threshold (15 to 20) of eosinophils (Eos) per high-power field (HPF). Since the current counting process of Eos is a resource-intensive process for human pathologists, automatic methods are desired. Circle representation has been shown as a more precise, yet less complicated, representation for automatic instance cell segmentation such as CircleSnake approach. However, the CircleSnake was designed as a single-label model, which is not able to deal with multi-label scenarios. In this paper, we propose the multi-label CircleSnake model for instance segmentation on Eos. It extends the original CircleSnake model from a single-label design to a multi-label model, allowing segmentation of multiple object types. Experimental results illustrate the CircleSnake model’s superiority over the traditional Mask R-CNN model and DeepSnake model in terms of average precision (AP) in identifying and segmenting eosinophils, thereby enabling enhanced characterization of EoE. This automated approach holds promise for streamlining the assessment process and improving diagnostic accuracy in EoE analysis. The source code has been made publicly available at https://github.com/yilinliu610730/ EoE. © 2024 SPIE.",CircleSnake; Eosinophilic Esophagitis; Mask R-CNN,Conference paper,Final,All Open Access; Green Accepted Open Access; Green Open Access,Scopus,2-s2.0-85191303957
"Xiong, J.; Liu, Y.; Deng, R.; Tyree, R.N.; Huo, Y.; Hiremath, G.","Xiong, Juming (58550762500); Liu, Yilin (58394867100); Deng, Ruining (57219448253); Tyree, Regina N. (57210803860); Huo, Yuankai (56830058500); Hiremath, Girish S. (12798054500)",58550762500; 58394867100; 57219448253; 57210803860; 56830058500; 12798054500,Deep Learning-Based Open Source Toolkit for Eosinophil Detection in Pediatric Eosinophilic Esophagitis,2024,Progress in Biomedical Optics and Imaging - Proceedings of SPIE,12933,,129330X,,,3,10.1117/12.3006520,https://www.scopus.com/inward/record.uri?eid=2-s2.0-85191295792&doi=10.1117%2F12.3006520&partnerID=40&md5=dd0a691c7f5c14dba750e7d2c541f6f4,"Eosinophilic Esophagitis (EoE) is a chronic, immune/antigen-mediated esophageal disease, characterized by symptoms related to esophageal dysfunction and histological evidence of eosinophil-dominant inflammation. Owing to the intricate microscopic representation of EoE in imaging, current methodologies which depend on manual identification are not only labor-intensive but also prone to inaccuracies. In this study, we develop an open-source toolkit, named Open-EoE, to perform end-to-end whole slide image (WSI) level eosinophil (Eos) detection using one line of command via Docker. Specifically, the toolkit supports three state-of-the-art deep learning-based object detection models. Furthermore, Open-EoE further optimizes the performance by implementing an ensemble learning strategy, and enhancing the precision and reliability of our results. The experimental results demonstrated that the Open-EoE toolkit can efficiently detect Eos on a testing set with 289 WSIs. At the widely accepted threshold of ≥ 15 Eos per high power field (HPF) for diagnosing EoE, the Open-EoE achieved an accuracy of 91%, showing decent consistency with pathologist evaluations. This suggests a promising avenue for integrating machine learning methodologies into the diagnostic process for EoE. The docker and source code has been made publicly available at https://github.com/hrlblab/Open-EoE. © 2024 SPIE.",Deep learning; Eosinophilic esophagitis; Object detection,Conference paper,Final,All Open Access; Green Accepted Open Access; Green Open Access,Scopus,2-s2.0-85191295792
"Bao, S.; Zhu, S.; Kolachala, V.L.; Remedios, L.W.; Hwang, Y.; Sun, Y.; Deng, R.; Cui, C.; Zhang, R.; Li, Y.; Li, J.; Roland, J.T.; Liu, Q.; Lau, K.S.; Kugathasan, S.; Qiu, P.; Wilson, K.T.; Coburn, L.A.; Landman, B.A.; Huo, Y.","Bao, Shunxing (57189987093); Zhu, Sichen (58576834100); Kolachala, Vasantha L. (6507622652); Remedios, Lucas W. (57226830336); Hwang, Yeonjoo (58576712600); Sun, Yutong (57748608600); Deng, Ruining (57219448253); Cui, Can (57219469236); Zhang, Rendong (58119414700); Li, Yike (50061507600); Li, Jia (57223877581); Roland, Joseph T. (8094809800); Liu, Qi (57071806700); Lau, Ken S. (7401560116); Kugathasan, Subra (6603770341); Qiu, Peng (8951268900); Wilson, Keith Tucker (57202597534); Coburn, Lori A. (6603410655); Landman, Bennett Allan (16679175200); Huo, Yuankai (56830058500)",57189987093; 58576834100; 6507622652; 57226830336; 58576712600; 57748608600; 57219448253; 57219469236; 58119414700; 50061507600; 57223877581; 8094809800; 57071806700; 7401560116; 6603770341; 8951268900; 57202597534; 6603410655; 16679175200; 56830058500,Cell Spatial Analysis in Crohn’s Disease: Unveiling Local Cell Arrangement Pattern with Graph-based Signatures,2024,Progress in Biomedical Optics and Imaging - Proceedings of SPIE,12933,,1293314,,,1,10.1117/12.3006675,https://www.scopus.com/inward/record.uri?eid=2-s2.0-85191291971&doi=10.1117%2F12.3006675&partnerID=40&md5=05e4e8be94d34c7a67d05b160972d6b8,"Crohn’s disease (CD) is a chronic and relapsing inflammatory condition that affects segments of the gastrointestinal tract. CD activity is determined by histological findings, particularly the density of neutrophils observed on Hematoxylin and Eosin stains (H&E) imaging. However, understanding the broader morphometry and local cell arrangement beyond cell counting and tissue morphology remains challenging. To address this, we characterize six distinct cell types from H&E images and develop a novel approach for the local spatial signature of each cell. Specifically, we create a 10-cell neighborhood matrix, representing neighboring cell arrangements for each individual cell. Utilizing t-SNE for non-linear spatial projection in scatter-plot and Kernel Density Estimation contour-plot formats, our study examines patterns of differences in the cellular environment associated with the odds ratio of spatial patterns between active CD and control groups. This analysis is based on data collected at the two research institutes. The findings reveal heterogeneous nearest-neighbor patterns, signifying distinct tendencies of cell clustering, with a particular focus on the rectum region. These variations underscore the impact of data heterogeneity on cell spatial arrangements in CD patients. Moreover, the spatial distribution disparities between the two research sites highlight the significance of collaborative efforts among healthcare organizations. All research analysis pipeline tools are available at https://github.com/MASILab/cellNN. © 2024 SPIE.",Cell spatial analysis; Crohn’s disease; Pattern recognition,Conference paper,Final,All Open Access; Green Accepted Open Access; Green Open Access,Scopus,2-s2.0-85191291971
"Yao, T.; Rheault, F.; Cai, L.Y.; Nath, V.; Asad, Z.; Newlin, N.; Cui, C.; Deng, R.; Ramadass, K.; Shafer, A.; Resnick, S.; Schilling, K.; Landman, B.A.; Huo, Y.","Yao, Tianyuan (57222525765); Rheault, François (57062832800); Cai, Leon Y. (57203145686); Nath, Vishwesh (57194026100); Asad, Zuhayr (57249905900); Newlin, Nancy R. (58133978900); Cui, Can (57219469236); Deng, Ruining (57219448253); Ramadass, Karthik (57221294056); Shafer, Andrea T. (54080377200); Resnick, Susan M. (7102831381); Schilling, Kurt G. (56192036700); Landman, Bennett Allan (16679175200); Huo, Yuankai (56830058500)",57222525765; 57062832800; 57203145686; 57194026100; 57249905900; 58133978900; 57219469236; 57219448253; 57221294056; 54080377200; 7102831381; 56192036700; 16679175200; 56830058500,Robust fiber orientation distribution function estimation using deep constrained spherical deconvolution for diffusion-weighted magnetic resonance imaging,2024,Journal of Medical Imaging,11,1,014005,,,6,10.1117/1.JMI.11.1.014005,https://www.scopus.com/inward/record.uri?eid=2-s2.0-85186331268&doi=10.1117%2F1.JMI.11.1.014005&partnerID=40&md5=8bf354d2bc119159152b320c2fe57627,"Purpose: Diffusion-weighted magnetic resonance imaging (DW-MRI) is a critical imaging method for capturing and modeling tissue microarchitecture at a millimeter scale. A common practice to model the measured DW-MRI signal is via fiber orientation distribution function (fODF). This function is the essential first step for the downstream tractography and connectivity analyses. With recent advantages in data sharing, large-scale multisite DW-MRI datasets are being made available for multisite studies. However, measurement variabilities (e.g., inter- and intrasite variability, hardware performance, and sequence design) are inevitable during the acquisition of DW-MRI. Most existing model-based methods [e.g., constrained spherical deconvolution (CSD)] and learning-based methods (e.g., deep learning) do not explicitly consider such variabilities in fODF modeling, which consequently leads to inferior performance on multisite and/or longitudinal diffusion studies. Approach: In this paper, we propose a data-driven deep CSD method to explicitly constrain the scan–rescan variabilities for a more reproducible and robust estimation of brain microstructure from repeated DW-MRI scans. Specifically, the proposed method introduces a three-dimensional volumetric scanner-invariant regularization scheme during the fODF estimation. We study the Human Connectome Project (HCP) young adults test–retest group as well as the MASiVar dataset (with inter- and intrasite scan/rescan data). The Baltimore Longitudinal Study of Aging dataset is employed for external validation. Results: From the experimental results, the proposed data-driven framework outperforms the existing benchmarks in repeated fODF estimation. By introducing the contrastive loss with scan/rescan data, the proposed method achieved a higher consistency while maintaining higher angular correlation coefficients with the CSD modeling. The proposed method is assessing the downstream connectivity analysis and shows increased performance in distinguishing subjects with different biomarkers. Conclusion: We propose a deep CSD method to explicitly reduce the scan–rescan variabilities, so as to model a more reproducible and robust brain microstructure from repeated DW-MRI scans. The plug-and-play design of the proposed approach is potentially applicable to a wider range of data harmonization problems in neuroimaging. © 2024 SPIE.",deep learning; diffusion magnetic resonance imaging; modeling,Article,Final,All Open Access; Green Accepted Open Access; Green Open Access; Hybrid Gold Open Access,Scopus,2-s2.0-85186331268
"Cui, C.; Deng, R.; Guo, J.; Liu, Q.; Yao, T.; Yang, H.; Huo, Y.","Cui, Can (57219469236); Deng, Ruining (57219448253); Guo, Junlin (58170992800); Liu, Quan (57336485300); Yao, Tianyuan (57222525765); Yang, Haichun (8638224800); Huo, Yuankai (56830058500)",57219469236; 57219448253; 58170992800; 57336485300; 57222525765; 8638224800; 56830058500,Enhancing Physician Flexibility: Prompt-Guided Multi-class Pathological Segmentation for Diverse Outcomes,2024,"BHI 2024 - IEEE-EMBS International Conference on Biomedical and Health Informatics, Proceedings",,,,,,3,10.1109/BHI62660.2024.10913563,https://www.scopus.com/inward/record.uri?eid=2-s2.0-105001393040&doi=10.1109%2FBHI62660.2024.10913563&partnerID=40&md5=598e63829bfe11d6b232c98bcabbca37,"The Vision Foundation Model has recently gained attention in medical image analysis. Its zero-shot learning capabilities accelerate AI deployment and enhance the generalizability of clinical applications. However, segmenting pathological images presents a special focus on the flexibility of segmentation targets. For instance, a single click on a Whole Slide Image (WSI) could signify a cell, a functional unit, or layers, adding layers of complexity to the segmentation tasks. Current models primarily predict potential outcomes but lack the flexibility needed for physician input. In this paper, we explore the potential of enhancing segmentation model flexibility by introducing various task prompts through a Large Language Model (LLM), compared to traditional task ID tokens. Our contribution is in four-fold: (1) we construct a computational-efficient pipeline that uses finetuned language prompts to guide flexible multi-class segmentation; (2) We compare segmentation performance with fixed prompts against free-text; (3) We design a multi-task kidney pathology segmentation dataset and the corresponding various free-text prompts; and (4) We evaluate our approach on the kidney pathology dataset, assessing its capacity to new cases during inference. © 2024 IEEE.",Medical image segmentation; Renal pathology; Visual-language model,Conference paper,Final,,Scopus,2-s2.0-105001393040
"Deng, R.; Liu, Q.; Cui, C.; Yao, T.; Long, J.; Asad, Z.; Womick, R.M.; Zhu, Z.; Fogo, A.B.; Zhao, S.; Yang, H.; Huo, Y.","Deng, Ruining (57219448253); Liu, Quan (57336485300); Cui, Can (57219469236); Yao, Tianyuan (57222525765); Long, Jun (35756419000); Asad, Zuhayr (57249905900); Womick, R. Michael (57786748800); Zhu, Zheyu (57219448236); Fogo, Agnes B. (7102673654); Zhao, Shillin (56415384300); Yang, Haichun (8638224800); Huo, Yuankai (56830058500)",57219448253; 57336485300; 57219469236; 57222525765; 35756419000; 57249905900; 57786748800; 57219448236; 7102673654; 56415384300; 8638224800; 56830058500,Omni-Seg: A Scale-Aware Dynamic Network for Renal Pathological Image Segmentation,2023,IEEE Transactions on Biomedical Engineering,70,9,,2636,2644,34,10.1109/TBME.2023.3260739,https://www.scopus.com/inward/record.uri?eid=2-s2.0-85151563110&doi=10.1109%2FTBME.2023.3260739&partnerID=40&md5=99b7fd64d20f7367764ccaedc9a664b3,"Comprehensive semantic segmentation on renal pathological images is challenging due to the heterogeneous scales of the objects. For example, on a whole slide image (WSI), the cross-sectional areas of glomeruli can be 64 times larger than that of the peritubular capillaries, making it impractical to segment both objects on the same patch, at the same scale. To handle this scaling issue, prior studies have typically trained multiple segmentation networks in order to match the optimal pixel resolution of heterogeneous tissue types. This multi-network solution is resource-intensive and fails to model the spatial relationship between tissue types. In this article, we propose the Omni-Seg network, a scale-aware dynamic neural network that achieves multi-object (six tissue types) and multi-scale (5× to 40× scale) pathological image segmentation via a single neural network. The contribution of this article is three-fold: (1) a novel scale-aware controller is proposed to generalize the dynamic neural network from single-scale to multi-scale; (2) semi-supervised consistency regularization of pseudo-labels is introduced to model the inter-scale correlation of unannotated tissue types into a single end-to-end learning paradigm; and (3) superior scale-aware generalization is evidenced by directly applying a model trained on human kidney images to mouse kidney images, without retraining. By learning from 150,000 human pathological image patches from six tissue types at three different resolutions, our approach achieved superior segmentation performance according to human visual assessment and evaluation of image-omics (i.e., spatial transcriptomics). © 1964-2012 IEEE.",image segmentation; multi-label; multi-scale; Renal pathology; semi-supervised learning,Article,Final,All Open Access; Green Accepted Open Access; Green Open Access,Scopus,2-s2.0-85151563110
"Bao, S.; Lee, H.H.; Yang, Q.; Remedios, L.W.; Deng, R.; Cui, C.; Cai, L.Y.; Xu, K.; Yu, X.; Chiron, S.; Li, Y.; Patterson, N.H.; Wang, Y.; Li, J.; Liu, Q.; Lau, K.S.; Roland, J.T.; Coburn, L.A.; Wilson, K.T.; Landman, B.A.; Huo, Y.","Bao, Shunxing (57189987093); Lee, Hohin (57219409783); Yang, Qi (58653285300); Remedios, Lucas W. (57226830336); Deng, Ruining (57219448253); Cui, Can (57219469236); Cai, Leon Y. (57203145686); Xu, Kaiwen (57218363938); Yu, Xin (57309160700); Chiron, Sophie (57222559307); Li, Yike (50061507600); Patterson, Nathan Heath (55555923300); Wang, Yaohong (55734196100); Li, Jia (57223877581); Liu, Qi (57071806700); Lau, Ken S. (7401560116); Roland, Joseph T. (8094809800); Coburn, Lori A. (6603410655); Wilson, Keith Tucker (57202597534); Landman, Bennett Allan (16679175200); Huo, Yuankai (56830058500)",57189987093; 57219409783; 58653285300; 57226830336; 57219448253; 57219469236; 57203145686; 57218363938; 57309160700; 57222559307; 50061507600; 55555923300; 55734196100; 57223877581; 57071806700; 7401560116; 8094809800; 6603410655; 57202597534; 16679175200; 56830058500,Alleviating tiling effect by random walk sliding window in high-resolution histological whole slide image synthesis,2023,Proceedings of Machine Learning Research,227,,,1407,1422,5,,https://www.scopus.com/inward/record.uri?eid=2-s2.0-85182708879&partnerID=40&md5=1dd9d5b2778bcd13a75a77cec17d0006,"Multiplex immunofluorescence (MxIF) is an advanced molecular imaging technique that can simultaneously provide biologists with multiple (i.e., more than 20) molecular markers on a single histological tissue section. Unfortunately, due to imaging restrictions, the more routinely used hematoxylin and eosin (H&E) stain is typically unavailable with MxIF on the same tissue section. As biological H&E staining is not feasible, previous efforts have been made to obtain H&E whole slide image (WSI) from MxIF via deep learning empowered virtual staining. However, the tiling effect is a long-lasting problem in high-resolution WSI-wise synthesis. The MxIF to H&E synthesis is no exception. Limited by computational resources, the cross-stain image synthesis is typically performed at the patch-level. Thus, discontinuous intensities might be visually identified along with the patch boundaries assembling all individual patches back to a WSI. In this work, we propose a deep learning based unpaired high-resolution image synthesis method to obtain virtual H&E WSIs from MxIF WSIs (each with 27 markers/stains) with reduced tiling effects. Briefly, we first extend the CycleGAN framework by adding simultaneous nuclei and mucin segmentation supervision as spatial constraints. Then, we introduce a random walk sliding window shifting strategy during the optimized inference stage, to alleviate the tiling effects. The validation results show that our spatially constrained synthesis method achieves a 56% performance gain for the downstream cell segmentation task. The proposed inference method reduces the tiling effects by using 50% fewer computation resources without compromising performance. The proposed random sliding window inference method is a plug-and-play module, which can be generalized for other high-resolution WSI image synthesis applications. The source code with our proposed model are available at https://github.com/MASILab/RandomWalkSlidingWindow.git. © 2023 CC-BY 4.0, S. Bao et al.",spatial constraints; tiling effect; Unpaired synthesis,Conference paper,Final,,Scopus,2-s2.0-85182708879
